{
  "schemaVersion": 1,
  "kind": "system_catalog_source_bindings",
  "catalogRepository": "heimgewebe/systemkatalog",
  "observedAt": "2026-09-06T11:46:30Z",
  "systems": [
    {
      "system": "actor:alexander",
      "source": {
        "repository": "heimgewebe/systemkatalog",
        "commit": "3556d586c96f80fe2582437c9ffe3f452d6d82ff",
        "locator": {
          "kind": "json_pointer",
          "path": "registry/ecosystem/nodes.json",
          "pointer": "/nodes/0",
          "contentSha256": "842d24fee6df13da43cf6be3ebe393f083e5f788071850be38a7aa43884784a6"
        },
        "defaultBranch": "main"
      },
      "reviewedAt": "2026-08-07T09:22:00+02:00",
      "method": "catalog_curator_review",
      "uncertainty": 0.15
    },
    {
      "system": "artifact:ecosystem-map",
      "source": {
        "repository": "heimgewebe/systemkatalog",
        "commit": "3556d586c96f80fe2582437c9ffe3f452d6d82ff",
        "locator": {
          "kind": "json_pointer",
          "path": "registry/ecosystem/nodes.json",
          "pointer": "/nodes/1",
          "contentSha256": "842d24fee6df13da43cf6be3ebe393f083e5f788071850be38a7aa43884784a6"
        },
        "defaultBranch": "main"
      },
      "reviewedAt": "2026-08-07T09:22:00+02:00",
      "method": "catalog_curator_review",
      "uncertainty": 0.15
    },
    {
      "system": "repo:systemkatalog",
      "source": {
        "repository": "heimgewebe/systemkatalog",
        "commit": "2f1075b15ba79e8c7e435e7c40939dc89520922b",
        "locator": {
          "kind": "file",
          "path": "README.md",
          "contentSha256": "aef625fa6dd2b7256893768a7cc244362a5b6961943b01a9988d5edb56d6c8c4"
        },
        "defaultBranch": "main"
      },
      "reviewedAt": "2026-08-07T07:45:16.263100Z",
      "method": "repository_primary_document",
      "uncertainty": 0.01
    },
    {
      "system": "repo:bureau",
      "source": {
        "repository": "heimgewebe/bureau",
        "commit": "bfa44a83a76de053991b271883c738e87c854397",
        "locator": {
          "kind": "file",
          "path": "README.md",
          "contentSha256": "395960b2ca6a06310216123b7c311ad58fb0fa3adc55837fc26a649ea7c0358c"
        },
        "defaultBranch": "main"
      },
      "reviewedAt": "2026-07-26T18:09:02Z",
      "method": "repository_primary_document",
      "uncertainty": 0.08
    },
    {
      "system": "repo:grabowski",
      "source": {
        "repository": "heimgewebe/grabowski",
        "commit": "6b2b1a70423e3fccf68c75432b44bef17a02579d",
        "locator": {
          "kind": "file",
          "path": "README.md",
          "contentSha256": "dccfed0f3032a4095a6b2cd68314c8718a5fcb771c624cc024cc7965cf3578c0"
        },
        "defaultBranch": "main"
      },
      "reviewedAt": "2026-08-07T07:45:16.263100Z",
      "method": "repository_primary_document",
      "uncertainty": 0.08
    },
    {
      "system": "repo:commonthing",
      "source": {
        "repository": "heimgewebe/commonthing",
        "commit": "322655285b520d04363e48487ae64d57264de573",
        "locator": {
          "kind": "file",
          "path": "architecture/weltgewebe-os.md",
          "contentSha256": "a8afc647c472cb16aedd0a5f63a499db4c00676a6bdac800ded531855e26a65f"
        },
        "defaultBranch": "main"
      },
      "reviewedAt": "2026-09-01T16:28:04Z",
      "method": "repository_normative_contract",
      "uncertainty": 0.01
    },
    {
      "system": "repo:repoground",
      "source": {
        "repository": "heimgewebe/repoground",
        "commit": "5548ca2d23a3d22ffe14fb1006363e4078e7c009",
        "locator": {
          "kind": "file",
          "path": "README.md",
          "contentSha256": "34de5eedbd3cc9c7340887c12c97e5241b8060c17f2ff90f9facc1e175f03d9c"
        },
        "defaultBranch": "main"
      },
      "reviewedAt": "2026-08-03T07:22:31+02:00",
      "method": "repository_primary_document",
      "uncertainty": 0.01
    },
    {
      "system": "repo:reposkop",
      "source": {
        "repository": "heimgewebe/reposkop",
        "commit": "6c0847c2cbc6ee1d1cff52fc1b4a1c5ee17af487",
        "locator": {
          "kind": "file",
          "path": "README.md",
          "contentSha256": "a6b63794cd4ec41e30e979fd524349386d207673700c3bc4c369f3fa0619ae94"
        },
        "defaultBranch": "main"
      },
      "reviewedAt": "2026-08-01T20:20:27+02:00",
      "method": "repository_primary_document",
      "uncertainty": 0.02
    },
    {
      "system": "repo:labor",
      "source": {
        "repository": "heimgewebe/labor",
        "commit": "63c3d533dad4d51775aba7746915b5c8c5086f42",
        "locator": {
          "kind": "file",
          "path": "README.md",
          "contentSha256": "0949d20b07df77ec2d1976b754258e837ef4b4a0b9a799daa4560f9413300bd8"
        },
        "defaultBranch": "main"
      },
      "reviewedAt": "2026-09-06T11:46:30Z",
      "method": "repository_primary_document",
      "uncertainty": 0.08
    },
    {
      "system": "repo:alpha-lab",
      "source": {
        "repository": "heimgewebe/alpha-lab",
        "commit": "redacted",
        "locator": {
          "kind": "private_repository_metadata",
          "contentSha256": "53b14e4c21464a543b0361e3cef85dd05e6f362dc78b382915598b695fc180b8"
        },
        "defaultBranch": "main"
      },
      "reviewedAt": "2026-08-07T08:23:00+02:00",
      "method": "private_repository_metadata_projection",
      "uncertainty": 0.25
    },
    {
      "system": "repo:chronik",
      "source": {
        "repository": "heimgewebe/chronik",
        "commit": "ac2d01bdf7a15732c9239c95e715d6bb43cf19c6",
        "locator": {
          "kind": "file",
          "path": "README.md",
          "contentSha256": "dbf0f5c222a083662a4eb14aa4df698078ababd1f14c4bc796e1b17c3c54822e"
        },
        "defaultBranch": "main"
      },
      "reviewedAt": "2026-07-15T21:18:00Z",
      "method": "repository_primary_document",
      "uncertainty": 0.01
    },
    {
      "system": "repo:schauwerk",
      "source": {
        "repository": "heimgewebe/schauwerk",
        "commit": "8bdc86d013de3dfde0cb8502291cc8cfee6faba0",
        "locator": {
          "kind": "file",
          "path": "README.md",
          "contentSha256": "72fc8e0d66600cefa4a3f01dfda9fc6e95f04067352216da6ffe79edfcd0e9ab"
        },
        "defaultBranch": "main"
      },
      "reviewedAt": "2026-07-26T18:09:02Z",
      "method": "repository_primary_document",
      "uncertainty": 0.02
    },
    {
      "system": "repo:infra",
      "source": {
        "repository": "heimgewebe/infra",
        "commit": "redacted",
        "locator": {
          "kind": "private_repository_metadata",
          "contentSha256": "fcc2ecef372148f1d2e1b5a9fd2737baee8bd556383451979141822791cd96fa"
        },
        "defaultBranch": "main"
      },
      "reviewedAt": "2026-07-13T07:55:00+02:00",
      "method": "private_repository_metadata_projection",
      "uncertainty": 0.25
    },
    {
      "system": "repo:device-graph",
      "source": {
        "repository": "heimgewebe/device-graph",
        "commit": "999c5ca410ac3e0d5e49af46a82f08e470ffd4c5",
        "locator": {
          "kind": "file",
          "path": "README.md",
          "contentSha256": "5387bd8bba7f9d8df9b0c752b57fb0a2e180b925111c6fa25cf2662dc4abaf2b"
        },
        "defaultBranch": "main"
      },
      "reviewedAt": "2026-07-13T07:55:00+02:00",
      "method": "repository_primary_document",
      "uncertainty": 0.08
    },
    {
      "system": "service:github",
      "source": {
        "repository": "heimgewebe/systemkatalog",
        "commit": "3556d586c96f80fe2582437c9ffe3f452d6d82ff",
        "locator": {
          "kind": "json_pointer",
          "path": "registry/ecosystem/nodes.json",
          "pointer": "/nodes/14",
          "contentSha256": "842d24fee6df13da43cf6be3ebe393f083e5f788071850be38a7aa43884784a6"
        },
        "defaultBranch": "main"
      },
      "reviewedAt": "2026-08-07T09:22:00+02:00",
      "method": "catalog_curator_review",
      "uncertainty": 0.15
    },
    {
      "system": "service:ci",
      "source": {
        "repository": "heimgewebe/systemkatalog",
        "commit": "3556d586c96f80fe2582437c9ffe3f452d6d82ff",
        "locator": {
          "kind": "json_pointer",
          "path": "registry/ecosystem/nodes.json",
          "pointer": "/nodes/15",
          "contentSha256": "842d24fee6df13da43cf6be3ebe393f083e5f788071850be38a7aa43884784a6"
        },
        "defaultBranch": "main"
      },
      "reviewedAt": "2026-08-07T09:22:00+02:00",
      "method": "catalog_curator_review",
      "uncertainty": 0.15
    },
    {
      "system": "repo:leitstand",
      "source": {
        "repository": "heimgewebe/leitstand",
        "commit": "362dda6ac161bf275a38682d18998fc284eebe52",
        "locator": {
          "kind": "file",
          "path": "README.md",
          "contentSha256": "6fcc6537ade5c39ac1a9427d0a0da4423b836886d760835a458e731fd1450848"
        },
        "defaultBranch": "main"
      },
      "reviewedAt": "2026-08-01T07:17:09+02:00",
      "method": "repository_primary_document",
      "uncertainty": 0.01
    },
    {
      "system": "repo:plexer",
      "source": {
        "repository": "heimgewebe/plexer",
        "commit": "5bad8aa38c54ca813b59119b81030173e4c21d3b",
        "locator": {
          "kind": "file",
          "path": "README.md",
          "contentSha256": "812f7b54467776636c761335f3b02cb43d7828dacc86774aab281c9db6757b03"
        },
        "defaultBranch": "main"
      },
      "reviewedAt": "2026-08-07T07:45:16.263100Z",
      "method": "repository_primary_document",
      "uncertainty": 0.01
    },
    {
      "system": "repo:heimlern",
      "source": {
        "repository": "heimgewebe/heimlern",
        "commit": "f74579cbe46d5f5f7b95c4c3431da03efb67cc85",
        "locator": {
          "kind": "file",
          "path": "docs/archive-readiness.v1.json",